{
  "schema_version": "unified-source-page/4.0",
  "document_id": "gp-coulton-creek-capital-q42023-company-financial-overview-cf569a8b25fc",
  "source_sha256": "cf569a8b25fcd36301b34e0e976e88227faa9f9cdc7804f34eddad09e8d477ad",
  "page": 2,
  "blocks": [
    {
      "schema_version": "unified-source-block/3.0",
      "document_id": "gp-coulton-creek-capital-q42023-company-financial-overview-cf569a8b25fc",
      "type": "group",
      "semantic_role": "document_section",
      "page": 2,
      "block_id": "p002-section-001",
      "hierarchy": {
        "parent_block_id": null,
        "child_block_ids": [
          "p002-r002-block",
          "p002-r003-block",
          "p002-r004-block",
          "p002-r005-block",
          "p002-r001-photograph",
          "p002-u001-brand-mark"
        ],
        "depth": 0,
        "heading_level": null
      },
      "content": {
        "role": "section",
        "child_block_ids": [
          "p002-r002-block",
          "p002-r003-block",
          "p002-r004-block",
          "p002-r005-block",
          "p002-r001-photograph",
          "p002-u001-brand-mark"
        ]
      },
      "coordinates": [
        68.333333,
        63.644444,
        898.818194,
        880.504536
      ],
      "coordinate_system": "top-left normalized xywh 0..1000",
      "extraction_method": [
        "Python heading-led hierarchy"
      ],
      "confidence": 0.95454,
      "validation": {
        "status": "passed",
        "errors": [],
        "warnings": []
      },
      "provenance": {
        "source_sha256": "cf569a8b25fcd36301b34e0e976e88227faa9f9cdc7804f34eddad09e8d477ad",
        "region_id": "p002-section-001",
        "classification_method": "heading-led-section-grouping",
        "reading_order": 1,
        "source_bbox_points": null,
        "ocr_evidence_ids": [],
        "rendered_page": "page-images/page-002.png"
      }
    },
    {
      "schema_version": "unified-source-block/3.0",
      "document_id": "gp-coulton-creek-capital-q42023-company-financial-overview-cf569a8b25fc",
      "type": "heading",
      "semantic_role": "page_title",
      "page": 2,
      "block_id": "p002-r002-block",
      "hierarchy": {
        "parent_block_id": "p002-section-001",
        "child_block_ids": [],
        "depth": 1,
        "heading_level": 1
      },
      "content": {
        "text": "OVERVIEW",
        "evidence_text": {
          "selected": "native",
          "native": "OVERVIEW",
          "ocr": "OVERVIEW",
          "token_agreement": 1.0
        }
      },
      "coordinates": [
        98.133194,
        63.644444,
        146.633333,
        44.444444
      ],
      "coordinate_system": "top-left normalized xywh 0..1000",
      "extraction_method": [
        "native PDF text",
        "Python layout normalization"
      ],
      "confidence": 1.0,
      "validation": {
        "status": "passed",
        "errors": [],
        "warnings": []
      },
      "provenance": {
        "source_sha256": "cf569a8b25fcd36301b34e0e976e88227faa9f9cdc7804f34eddad09e8d477ad",
        "region_id": "p002-r002",
        "classification_method": "native-positioned-words",
        "reading_order": 2,
        "source_bbox_points": [
          70.6559,
          34.367999999999995,
          176.23190000000002,
          58.367999999999995
        ],
        "ocr_evidence_ids": [
          "p002-ocr-0001"
        ],
        "rendered_page": "page-images/page-002.png"
      }
    },
    {
      "schema_version": "unified-source-block/3.0",
      "document_id": "gp-coulton-creek-capital-q42023-company-financial-overview-cf569a8b25fc",
      "type": "text",
      "semantic_role": "body_text",
      "page": 2,
      "block_id": "p002-r003-block",
      "hierarchy": {
        "parent_block_id": "p002-section-001",
        "child_block_ids": [],
        "depth": 1,
        "heading_level": null
      },
      "content": {
        "text": "Coulton Creek Capital LLC is a private investment company that seeks out opportunistic debt and equity investments in real estate opportunities.",
        "evidence_text": {
          "selected": "native",
          "native": "Coulton Creek Capital LLC is a\nprivate investment company that\nseeks out opportunistic debt and\nequity investments in real estate\nopportunities.",
          "ocr": "Coulton Creek Capital LLC is a\nprivate investment company tha\nseeks out opportunistic debt and\nequity investments in real estate\nopportunities.",
          "token_agreement": 0.90909
        }
      },
      "coordinates": [
        68.333333,
        192.898444,
        342.1824,
        157.590222
      ],
      "coordinate_system": "top-left normalized xywh 0..1000",
      "extraction_method": [
        "native PDF text",
        "Python layout normalization"
      ],
      "confidence": 0.95454,
      "validation": {
        "status": "passed",
        "errors": [],
        "warnings": []
      },
      "provenance": {
        "source_sha256": "cf569a8b25fcd36301b34e0e976e88227faa9f9cdc7804f34eddad09e8d477ad",
        "region_id": "p002-r003",
        "classification_method": "native-positioned-words",
        "reading_order": 3,
        "source_bbox_points": [
          49.2,
          104.16516000000001,
          295.571328,
          189.26387999999992
        ],
        "ocr_evidence_ids": [
          "p002-ocr-0002",
          "p002-ocr-0003",
          "p002-ocr-0004",
          "p002-ocr-0005",
          "p002-ocr-0006"
        ],
        "rendered_page": "page-images/page-002.png"
      }
    },
    {
      "schema_version": "unified-source-block/3.0",
      "document_id": "gp-coulton-creek-capital-q42023-company-financial-overview-cf569a8b25fc",
      "type": "text",
      "semantic_role": "body_text",
      "page": 2,
      "block_id": "p002-r004-block",
      "hierarchy": {
        "parent_block_id": "p002-section-001",
        "child_block_ids": [],
        "depth": 1,
        "heading_level": null
      },
      "content": {
        "text": "The firm targets income producing real estate related investments between $1 million and $25 million.",
        "evidence_text": {
          "selected": "native",
          "native": "The firm targets income producing\nreal estate related investments\nbetween $1 million and $25 million.",
          "ocr": "The firm targets income producing\nreal estate related investments\nbetween $1 million and $25 million.",
          "token_agreement": 1.0
        }
      },
      "coordinates": [
        68.333333,
        399.166667,
        367.789333,
        93.572889
      ],
      "coordinate_system": "top-left normalized xywh 0..1000",
      "extraction_method": [
        "native PDF text",
        "Python layout normalization"
      ],
      "confidence": 1.0,
      "validation": {
        "status": "passed",
        "errors": [],
        "warnings": []
      },
      "provenance": {
        "source_sha256": "cf569a8b25fcd36301b34e0e976e88227faa9f9cdc7804f34eddad09e8d477ad",
        "region_id": "p002-r004",
        "classification_method": "native-positioned-words",
        "reading_order": 4,
        "source_bbox_points": [
          49.2,
          215.54999999999995,
          314.0083200000001,
          266.0793599999999
        ],
        "ocr_evidence_ids": [
          "p002-ocr-0007",
          "p002-ocr-0008",
          "p002-ocr-0009"
        ],
        "rendered_page": "page-images/page-002.png"
      }
    },
    {
      "schema_version": "unified-source-block/3.0",
      "document_id": "gp-coulton-creek-capital-q42023-company-financial-overview-cf569a8b25fc",
      "type": "contact",
      "semantic_role": "contact_information",
      "page": 2,
      "block_id": "p002-r005-block",
      "hierarchy": {
        "parent_block_id": "p002-section-001",
        "child_block_ids": [],
        "depth": 1,
        "heading_level": null
      },
      "content": {
        "text": "COULTON CREEK CAPITAL, LLC 5613 DTC PARKWAY, SUITE 830 GREENWOOD VILLAGE, CO 80111 720-502-1149 │ CCRCAPITAL.COM",
        "evidence_text": {
          "selected": "native",
          "native": "COULTON CREEK CAPITAL, LLC\n5613 DTC PARKWAY, SUITE 830\nGREENWOOD VILLAGE, CO 80111\n720-502-1149 │ CCRCAPITAL.COM",
          "ocr": "COULTON CREEK CAPITAL, LLC\n5613 DTC PARKWAY, SUITE 830\nGREENWOOD VILLAGE, CO 80111\n720-502-1149 |CCRCAPITAL.COM",
          "token_agreement": 1.0
        },
        "name": null,
        "organization": "COULTON CREEK CAPITAL, LLC",
        "address": {
          "street": "5613 DTC PARKWAY, SUITE 830",
          "city": "GREENWOOD VILLAGE",
          "state": "CO",
          "postal_code": "80111"
        },
        "email": null,
        "phone": "720-502-1149",
        "website": "https://CCRCAPITAL.COM"
      },
      "coordinates": [
        80.833333,
        736.823778,
        304.941,
        134.732
      ],
      "coordinate_system": "top-left normalized xywh 0..1000",
      "extraction_method": [
        "native PDF text",
        "Python layout normalization"
      ],
      "confidence": 1.0,
      "validation": {
        "status": "passed",
        "errors": [],
        "warnings": []
      },
      "provenance": {
        "source_sha256": "cf569a8b25fcd36301b34e0e976e88227faa9f9cdc7804f34eddad09e8d477ad",
        "region_id": "p002-r005",
        "classification_method": "native-positioned-words",
        "reading_order": 5,
        "source_bbox_points": [
          58.2,
          397.88484,
          277.75752,
          470.64012
        ],
        "ocr_evidence_ids": [
          "p002-ocr-0010",
          "p002-ocr-0011",
          "p002-ocr-0012",
          "p002-ocr-0013"
        ],
        "rendered_page": "page-images/page-002.png"
      }
    },
    {
      "schema_version": "unified-source-block/3.0",
      "document_id": "gp-coulton-creek-capital-q42023-company-financial-overview-cf569a8b25fc",
      "type": "photograph",
      "semantic_role": "photograph",